{
  "metadata": {
    "release": "1.0.0-ncd",
    "cutoff": "2026-09-05",
    "title": "NP-NCD source-bounded indicator release",
    "existingIndicatorRecords": 8,
    "newOfficialSourceRecords": 43,
    "boundary": "Complete transcription of the monitoring manifestations identified in Annexure 9.2 of the NP-NCD Operational Guidelines 2023-2030, supplemented by the four explicitly defined population-based-screening monitoring indicators in the current official training module. Authenticated National NCD Portal dictionaries and state additions are outside this release."
  },
  "sources": [
    {
      "id": "IND_NPNCD_2023_GUIDELINES",
      "source": "NP-NCD Operational Guidelines 2023-2030",
      "document": "National Programme for Prevention and Control of Non-Communicable Diseases Operational Guidelines",
      "version": "2023-2030",
      "url": "https://www.mohfw.gov.in/sites/default/files/NP-NCD%20Operational%20Guidelines.pdf",
      "boundary": "Annexure 9.2 input, process, training, communication, IT-use, output and outcome monitoring manifestations."
    },
    {
      "id": "IND_NPNCD_TRAINING_2025",
      "source": "Training Module for Programme Managers under NP-NCD",
      "document": "Training Modules for Programme Managers / Medical Officers under NP-NCD",
      "version": "Current official module accessed 2026-09-05",
      "url": "https://nhm.gov.in/New-Update-2025-26/Whats-new/Training-Modules-NCDs.pdf",
      "boundary": "Population-based screening definitions, service pathway, data system and monitoring formulae."
    }
  ],
  "records": [
    ["IND-NPNCD2-001","Status of State NCD Division","Infrastructure","Index","State NCD divisions","State NCD division status","Status of the State NCD Division using the source-defined reporting categories.","State/UT; national","State/UT","Quarterly",["Leadership and governance","Health workforce","Service delivery"],"Annexure 9.2 — Input"],
    ["IND-NPNCD2-002","Status of District NCD Division","Infrastructure","Index","District NCD divisions","District NCD division status","Status of District NCD Divisions using the source-defined reporting categories.","District; state/UT; national","District","Quarterly",["Leadership and governance","Health workforce","Service delivery"],"Annexure 9.2 — Input"],
    ["IND-NPNCD2-003","Status of District NCD Clinics","Infrastructure","Index","District NCD clinics","District NCD clinic status","Status of District NCD Clinics using the source-defined reporting categories.","District; state/UT; national","Facility","Quarterly",["Service delivery","Health workforce","Medical products, vaccines and technologies"],"Annexure 9.2 — Input"],
    ["IND-NPNCD2-004","Status of CHC NCD Clinics","Infrastructure","Index","CHC NCD clinics","CHC NCD clinic status","Status of CHC NCD Clinics using the source-defined reporting categories.","Block; district; state/UT; national","Facility","Quarterly",["Service delivery","Health workforce","Medical products, vaccines and technologies"],"Annexure 9.2 — Input"],
    ["IND-NPNCD2-005","HR approved posts at State Level","Human resources","Count","Not applicable to a count","Approved NP-NCD posts at State level","Number of NP-NCD human-resource posts approved at State level.","State/UT; national","State/UT","Half-yearly",["Health workforce","Leadership and governance"],"Annexure 9.2 — Input"],
    ["IND-NPNCD2-006","HR sanctioned posts at State Level","Human resources","Count","Not applicable to a count","Sanctioned NP-NCD posts at State level","Number of NP-NCD human-resource posts sanctioned at State level.","State/UT; national","State/UT","Half-yearly",["Health workforce","Leadership and governance"],"Annexure 9.2 — Input"],
    ["IND-NPNCD2-007","HR filled posts at State Level","Human resources","Count","Not applicable to a count","Filled NP-NCD posts at State level","Number of NP-NCD human-resource posts filled at State level.","State/UT; national","State/UT","Half-yearly",["Health workforce","Leadership and governance"],"Annexure 9.2 — Input"],
    ["IND-NPNCD2-008","HR approved posts at District Level","Human resources","Count","Not applicable to a count","Approved NP-NCD posts at District level","Number of NP-NCD human-resource posts approved at District level.","District; state/UT; national","District","Half-yearly",["Health workforce","Leadership and governance"],"Annexure 9.2 — Input"],
    ["IND-NPNCD2-009","HR sanctioned posts at District Level","Human resources","Count","Not applicable to a count","Sanctioned NP-NCD posts at District level","Number of NP-NCD human-resource posts sanctioned at District level.","District; state/UT; national","District","Half-yearly",["Health workforce","Leadership and governance"],"Annexure 9.2 — Input"],
    ["IND-NPNCD2-010","HR filled posts at District Level","Human resources","Count","Not applicable to a count","Filled NP-NCD posts at District level","Number of NP-NCD human-resource posts filled at District level.","District; state/UT; national","District","Half-yearly",["Health workforce","Leadership and governance"],"Annexure 9.2 — Input"],
    ["IND-NPNCD2-011","HR approved posts at Block Level","Human resources","Count","Not applicable to a count","Approved NP-NCD posts at Block level","Number of NP-NCD human-resource posts approved at Block level.","Block; district; state/UT; national","Block/planning unit","Half-yearly",["Health workforce","Leadership and governance"],"Annexure 9.2 — Input"],
    ["IND-NPNCD2-012","HR sanctioned posts at Block Level","Human resources","Count","Not applicable to a count","Sanctioned NP-NCD posts at Block level","Number of NP-NCD human-resource posts sanctioned at Block level.","Block; district; state/UT; national","Block/planning unit","Half-yearly",["Health workforce","Leadership and governance"],"Annexure 9.2 — Input"],
    ["IND-NPNCD2-013","HR filled posts at Block Level","Human resources","Count","Not applicable to a count","Filled NP-NCD posts at Block level","Number of NP-NCD human-resource posts filled at Block level.","Block; district; state/UT; national","Block/planning unit","Half-yearly",["Health workforce","Leadership and governance"],"Annexure 9.2 — Input"],
    ["IND-NPNCD2-014","Saturation of all districts having Standard Treatment Protocols for Hypertension and Diabetes","Service readiness","Percentage/proportion","All districts","Districts having Standard Treatment Protocols for hypertension and diabetes","Percentage of districts having Standard Treatment Protocols for hypertension and diabetes.","District; state/UT; national","District","Quarterly",["Service delivery","Leadership and governance"],"Annexure 9.2 — Process"],
    ["IND-NPNCD2-015","Saturation of all districts having NCD Clinics","Service readiness","Percentage/proportion","All districts","Districts having NCD clinics","Percentage of districts having NCD clinics.","District; state/UT; national","District","Quarterly",["Service delivery","Health workforce"],"Annexure 9.2 — Process"],
    ["IND-NPNCD2-016","Saturation of all CHCs having NCD Clinics","Service readiness","Percentage/proportion","All CHCs","CHCs having NCD clinics","Percentage of CHCs having NCD clinics.","Facility; block; district; state/UT; national","Facility","Quarterly",["Service delivery","Health workforce"],"Annexure 9.2 — Process"],
    ["IND-NPNCD2-017","Saturation of all districts having Chemotherapy related services","Service readiness","Percentage/proportion","All districts","Districts having chemotherapy-related services","Percentage of districts having chemotherapy-related services.","District; state/UT; national","District","Quarterly",["Service delivery","Medical products, vaccines and technologies"],"Annexure 9.2 — Process"],
    ["IND-NPNCD2-018","Saturation of all districts having COPD and asthma services","Service readiness","Percentage/proportion","All districts","Districts having COPD and asthma services","Percentage of districts having COPD and asthma services.","District; state/UT; national","District","Quarterly",["Service delivery","Medical products, vaccines and technologies"],"Annexure 9.2 — Process"],
    ["IND-NPNCD2-019","Saturation of all districts having STEMI services","Service readiness","Percentage/proportion","All districts","Districts having STEMI services","Percentage of districts having STEMI services.","District; state/UT; national","District","Quarterly",["Service delivery","Medical products, vaccines and technologies"],"Annexure 9.2 — Process"],
    ["IND-NPNCD2-020","Saturation of all districts having Stroke services","Service readiness","Percentage/proportion","All districts","Districts having stroke services","Percentage of districts having stroke services.","District; state/UT; national","District","Quarterly",["Service delivery","Medical products, vaccines and technologies"],"Annexure 9.2 — Process"],
    ["IND-NPNCD2-021","Saturation of all districts having Hemodialysis services","Service readiness","Percentage/proportion","All districts","Districts having haemodialysis services","Percentage of districts having haemodialysis services.","District; state/UT; national","District","Quarterly",["Service delivery","Medical products, vaccines and technologies"],"Annexure 9.2 — Process"],
    ["IND-NPNCD2-022","Percentage of Programme Officers/Medical Officers trained for NP-NCD Trainings","Training","Percentage/proportion","Programme Officers and Medical Officers requiring NP-NCD training","Programme Officers and Medical Officers trained for NP-NCD","Percentage of Programme Officers and Medical Officers trained for NP-NCD.","Facility; block; district; state/UT; national","Facility","Quarterly",["Health workforce","Service delivery"],"Annexure 9.2 — Training"],